[
  {
    "pago_id": "990e8400-e29b-41d4-a716-446655440001",
    "folio_pago": "PAG-227-001-P1",
    "orden_compra_id": "770e8400-e29b-41d4-a716-446655440001",
    "obra_id": "550e8400-e29b-41d4-a716-446655440001",
    "proveedor_id": "660e8400-e29b-41d4-a716-446655440001",
    "tipo_pago": "parcial",
    "numero_parcialidad": 1,
    "monto_pago": 20000.00,
    "metodo_pago": "transferencia",
    "fecha_programada": "2024-01-25",
    "fecha_procesado": "2024-01-25T15:30:00Z",
    "semana_fiscal": 4,
    "estado": "completado",
    "referencia_bancaria": "TRF-2024-0125-001",
    "comprobante_url": "https://storage.example.com/pagos/2024/01/PAG-227-001-P1.pdf",
    "requiere_factura": true,
    "factura_recibida": true,
    "observaciones": "Primera parcialidad. Pago contra primera entrega de concreto (15 M3). Proveedor tiene crédito a 30 días.",
    "procesado_por": "Lic. María Fernández (Tesorería)",
    "created_at": "2024-01-20T09:00:00Z",
    "updated_at": "2024-01-25T15:30:00Z"
  },
  {
    "pago_id": "990e8400-e29b-41d4-a716-446655440002",
    "folio_pago": "PAG-227-001-P2",
    "orden_compra_id": "770e8400-e29b-41d4-a716-446655440001",
    "obra_id": "550e8400-e29b-41d4-a716-446655440001",
    "proveedor_id": "660e8400-e29b-41d4-a716-446655440001",
    "tipo_pago": "parcial",
    "numero_parcialidad": 2,
    "monto_pago": 20078.00,
    "metodo_pago": "transferencia",
    "fecha_programada": "2024-02-15",
    "fecha_procesado": null,
    "semana_fiscal": 7,
    "estado": "programado",
    "referencia_bancaria": null,
    "comprobante_url": null,
    "requiere_factura": true,
    "factura_recibida": false,
    "observaciones": "Segunda parcialidad programada. Contra segunda entrega de concreto (15 M3). Vence crédito a 30 días.",
    "procesado_por": null,
    "created_at": "2024-01-25T16:00:00Z",
    "updated_at": "2024-01-25T16:00:00Z"
  },
  {
    "pago_id": "990e8400-e29b-41d4-a716-446655440003",
    "folio_pago": "PAG-227-002",
    "orden_compra_id": "770e8400-e29b-41d4-a716-446655440002",
    "obra_id": "550e8400-e29b-41d4-a716-446655440001",
    "proveedor_id": "660e8400-e29b-41d4-a716-446655440002",
    "tipo_pago": "total",
    "numero_parcialidad": null,
    "monto_pago": 27550.00,
    "metodo_pago": "transferencia",
    "fecha_programada": "2024-02-05",
    "fecha_procesado": null,
    "semana_fiscal": 6,
    "estado": "programado",
    "referencia_bancaria": null,
    "comprobante_url": null,
    "requiere_factura": true,
    "factura_recibida": false,
    "observaciones": "Pago programado dentro de los 15 días de crédito. Aprovechar descuento del 5% por pronto pago.",
    "procesado_por": null,
    "created_at": "2024-01-22T10:30:00Z",
    "updated_at": "2024-01-22T10:30:00Z"
  },
  {
    "pago_id": "990e8400-e29b-41d4-a716-446655440004",
    "folio_pago": "PAG-228-001",
    "orden_compra_id": "770e8400-e29b-41d4-a716-446655440003",
    "obra_id": "550e8400-e29b-41d4-a716-446655440002",
    "proveedor_id": "660e8400-e29b-41d4-a716-446655440003",
    "tipo_pago": "total",
    "numero_parcialidad": null,
    "monto_pago": 9860.00,
    "metodo_pago": "efectivo",
    "fecha_programada": "2024-02-05",
    "fecha_procesado": "2024-02-05T10:30:00Z",
    "semana_fiscal": 6,
    "estado": "completado",
    "referencia_bancaria": "EFECTIVO-001",
    "comprobante_url": "https://storage.example.com/pagos/2024/02/PAG-228-001.pdf",
    "requiere_factura": true,
    "factura_recibida": true,
    "observaciones": "Pago de contado en mostrador de HOME DEPOT. Proveedor sin crédito.",
    "procesado_por": "Ing. Laura Sánchez (Residente)",
    "created_at": "2024-02-05T08:00:00Z",
    "updated_at": "2024-02-07T16:00:00Z"
  },
  {
    "pago_id": "990e8400-e29b-41d4-a716-446655440005",
    "folio_pago": "PAG-229-001",
    "orden_compra_id": "770e8400-e29b-41d4-a716-446655440004",
    "obra_id": "550e8400-e29b-41d4-a716-446655440003",
    "proveedor_id": "660e8400-e29b-41d4-a716-446655440004",
    "tipo_pago": "total",
    "numero_parcialidad": null,
    "monto_pago": 46980.00,
    "metodo_pago": "transferencia",
    "fecha_programada": "2024-04-10",
    "fecha_procesado": null,
    "semana_fiscal": 15,
    "estado": "programado",
    "referencia_bancaria": null,
    "comprobante_url": null,
    "requiere_factura": true,
    "factura_recibida": false,
    "observaciones": "Pago programado para después de instalación. Proveedor otorga 30 días de crédito.",
    "procesado_por": null,
    "created_at": "2024-03-10T11:00:00Z",
    "updated_at": "2024-03-10T11:00:00Z"
  },
  {
    "pago_id": "990e8400-e29b-41d4-a716-446655440006",
    "folio_pago": "PAG-232-001",
    "orden_compra_id": "770e8400-e29b-41d4-a716-446655440006",
    "obra_id": "550e8400-e29b-41d4-a716-446655440005",
    "proveedor_id": "660e8400-e29b-41d4-a716-446655440006",
    "tipo_pago": "total",
    "numero_parcialidad": null,
    "monto_pago": 58510.40,
    "metodo_pago": "cheque",
    "fecha_programada": "2024-06-05",
    "fecha_procesado": null,
    "semana_fiscal": 23,
    "estado": "procesando",
    "referencia_bancaria": "CHQ-0012345",
    "comprobante_url": null,
    "requiere_factura": true,
    "factura_recibida": false,
    "observaciones": "Cheque en proceso de emisión. Material ya entregado. Esperando certificados de calidad para procesar pago.",
    "procesado_por": "Lic. María Fernández (Tesorería)",
    "created_at": "2024-05-20T14:00:00Z",
    "updated_at": "2024-05-28T11:30:00Z"
  }
]
